<?xml version="1.0" encoding="utf-8"?>
<sifSpecificationGeneratorConfig xmlns="http://www.sifassociation.org/sifSpecificationGenerator/1.0" xmlns:xsi="http://www.w3.org/2001/XMLSchema-instance" xsi:schemaLocation="http://www.sifassociation.org/sifSpecificationGenerator/1.0  sifSpecificationGeneratorConfig.xsd">
	
	<globalSettings>
		<inputDocument>SIF_DataModel.xml</inputDocument>
		<sifNamespace>http://www.sifinfo.org/au/infrastructure/2.x</sifNamespace>
		<localizationCode>au</localizationCode>
	</globalSettings>
	
	<htmlDocuments>
	
		<!-- document 1: many documents-->
		<htmlDocument>
			<singleDocument>false</singleDocument>
			<rootDocumentFileName>index.html</rootDocumentFileName>
			<rootTitle>SIF Implementation Specification (Australia) 1.4</rootTitle>
			<documentType>DataModel</documentType>
		</htmlDocument>
		
		<!-- document 2: Single document-->
		<htmlDocument>
			<singleDocument>true</singleDocument>
			<rootDocumentFileName>ImplementationSpecification.html</rootDocumentFileName>
			<rootTitle>SIF Implementation Specification (Australia) 1.4</rootTitle>
			<documentType>DataModel</documentType>
		</htmlDocument>
		
	</htmlDocuments>
	
	
	<webServiceDocuments>
   
  </webServiceDocuments>
  
  
	<xsdDocuments>
	
		<xsdDocument>
			<xsdTitle>SIF_MessageNoIncludes</xsdTitle>
			<diagram>true</diagram>
			<isDataModelXsd>false</isDataModelXsd>
			<isServiceBodyXsd>false</isServiceBodyXsd>
			<singleSchema>true</singleSchema>
			<annotate>false</annotate>
			<listWithKeyConstraints>false</listWithKeyConstraints>
			<isSifMessage2Xsd>false</isSifMessage2Xsd>
		</xsdDocument>
		
		<xsdDocument>
			<xsdTitle>SIF_MessageNoIncludesAnnotated</xsdTitle>
			<diagram>false</diagram>
			<isDataModelXsd>false</isDataModelXsd>
			<isServiceBodyXsd>false</isServiceBodyXsd>
			<singleSchema>true</singleSchema>
			<annotate>true</annotate>
			<listWithKeyConstraints>false</listWithKeyConstraints>
			<isSifMessage2Xsd>false</isSifMessage2Xsd>
		</xsdDocument>
		
		<xsdDocument>
			<xsdTitle>SIF_Message</xsdTitle>
			<diagram>false</diagram>
			<isDataModelXsd>false</isDataModelXsd>
			<isServiceBodyXsd>false</isServiceBodyXsd>
			<singleSchema>false</singleSchema>
			<annotate>false</annotate>
			<listWithKeyConstraints>false</listWithKeyConstraints>
			<isSifMessage2Xsd>false</isSifMessage2Xsd>
		</xsdDocument>
		
		<xsdDocument>
			<xsdTitle>SIF_MessageAnnotated</xsdTitle>
			<diagram>false</diagram>
			<isDataModelXsd>false</isDataModelXsd>
			<isServiceBodyXsd>false</isServiceBodyXsd>
			<singleSchema>false</singleSchema>
			<annotate>true</annotate>
			<listWithKeyConstraints>false</listWithKeyConstraints>
			<isSifMessage2Xsd>false</isSifMessage2Xsd>
		</xsdDocument>
		
		<xsdDocument>
			<xsdTitle>DataModelNoIncludes</xsdTitle>
			<diagram>false</diagram>
			<isDataModelXsd>true</isDataModelXsd>
			<isServiceBodyXsd>false</isServiceBodyXsd>
			<singleSchema>true</singleSchema>
			<annotate>false</annotate>
			<listWithKeyConstraints>false</listWithKeyConstraints>
			<isSifMessage2Xsd>false</isSifMessage2Xsd>
		</xsdDocument>
		
		<xsdDocument>
			<xsdTitle>DataModelNoIncludesAnnotated</xsdTitle>
			<diagram>false</diagram>
			<isDataModelXsd>true</isDataModelXsd>
			<isServiceBodyXsd>false</isServiceBodyXsd>
			<singleSchema>true</singleSchema>
			<annotate>true</annotate>
			<listWithKeyConstraints>false</listWithKeyConstraints>
			<isSifMessage2Xsd>false</isSifMessage2Xsd>
		</xsdDocument>
		
		<xsdDocument>
			<xsdTitle>DataModel</xsdTitle>
			<diagram>false</diagram>
			<isDataModelXsd>true</isDataModelXsd>
			<isServiceBodyXsd>false</isServiceBodyXsd>
			<singleSchema>false</singleSchema>
			<annotate>false</annotate>
			<listWithKeyConstraints>false</listWithKeyConstraints>
			<isSifMessage2Xsd>false</isSifMessage2Xsd>
		</xsdDocument>
		
		<xsdDocument>
			<xsdTitle>DataModelAnnotated</xsdTitle>
			<diagram>false</diagram>
			<isDataModelXsd>true</isDataModelXsd>
			<isServiceBodyXsd>false</isServiceBodyXsd>
			<singleSchema>false</singleSchema>
			<annotate>true</annotate>
			<listWithKeyConstraints>false</listWithKeyConstraints>
			<isSifMessage2Xsd>false</isSifMessage2Xsd>
		</xsdDocument>
		

		<xsdDocument>
			<xsdTitle>ServiceBodyDefinitions</xsdTitle>
			<diagram>false</diagram>
			<isDataModelXsd>false</isDataModelXsd>
			<isServiceBodyXsd>true</isServiceBodyXsd>
			<singleSchema>false</singleSchema>
			<annotate>true</annotate>
			<listWithKeyConstraints>false</listWithKeyConstraints>
			<isSifMessage2Xsd>false</isSifMessage2Xsd>
		</xsdDocument>  
		
	</xsdDocuments>
</sifSpecificationGeneratorConfig>
